{
  "$schema": "./scene.schema.json",
  "version": 1,
  "title": "Cornell box",
  "description": "A direct-light study with red and green walls, rotated blocks, glass, and copper.",
  "render": {
    "width": 640,
    "height": 480,
    "samples": 4,
    "light_samples": 3,
    "depth": 7
  },
  "camera": {
    "from": [0, 3.2, 12.5],
    "at": [0, 2.7, 0],
    "fov": 44
  },
  "materials": {
    "white": {
      "color": [230, 226, 215],
      "ambient": 0.09,
      "specular": 0.15
    },
    "red": {
      "color": [185, 33, 37],
      "specular": 0.05
    },
    "green": {
      "color": [49, 145, 68],
      "specular": 0.05
    },
    "glass": {
      "preset": "glass"
    },
    "copper": {
      "color": [204, 123, 65],
      "reflective": 0.58,
      "roughness": 0.07
    }
  },
  "lights": [
    {
      "type": "area",
      "corner": [-1.2, 5.8, -1],
      "u": [2.4, 0, 0],
      "v": [0, 0, 2],
      "color": [255, 247, 232],
      "intensity": 22
    },
    {
      "type": "point",
      "position": [0, 4, 4],
      "color": [220, 231, 255],
      "intensity": 4
    }
  ],
  "objects": [
    {
      "type": "cube",
      "min": [-3.2, -0.2, -3.2],
      "max": [3.2, 0, 3.2],
      "material": "white"
    },
    {
      "type": "cube",
      "min": [-3.2, 6, -3.2],
      "max": [3.2, 6.2, 3.2],
      "material": "white"
    },
    {
      "type": "cube",
      "min": [-3, 0, -3.2],
      "max": [3, 6, -3],
      "material": "white"
    },
    {
      "type": "cube",
      "min": [-3.2, 0, -3],
      "max": [-3, 6, 3],
      "material": "red"
    },
    {
      "type": "cube",
      "min": [3, 0, -3],
      "max": [3.2, 6, 3],
      "material": "green"
    },
    {
      "type": "cube",
      "material": "white",
      "transform": [
        {
          "scale": [0.85, 1.6, 0.85]
        },
        {
          "rotate_y": -18
        },
        {
          "translate": [1.1, 1.6, -0.9]
        }
      ]
    },
    {
      "type": "cube",
      "material": "white",
      "transform": [
        {
          "scale": [0.85, 0.8, 0.85]
        },
        {
          "rotate_y": 18
        },
        {
          "translate": [-1.2, 0.8, 0.6]
        }
      ]
    },
    {
      "type": "sphere",
      "material": "glass",
      "center": [-1.2, 2.25, 0.6],
      "radius": 0.65
    },
    {
      "type": "sphere",
      "material": "copper",
      "center": [1.4, 0.65, 1.7],
      "radius": 0.65
    }
  ]
}
